{
  "schema_version": "2.0",
  "run_id": "20260919T170200Z_AbyssalReefLE_day05priv",
  "seq": 0,
  "game_loop": 0,
  "source": "logger",
  "event_type": "run_manifest",
  "map_name": "AbyssalReefLE",
  "controller_tier": "T0",
  "chaos": false,
  "realtime": false,
  "mode": "default",
  "started_at_utc": "2026-09-19T17:02:00Z",
  "opponent": "built_in",
  "seed": 2,
  "analysis_intent": "demo",
  "llm_provider": null,
  "notes": {
    "synthetic": true,
    "leaked_path": "/home/someone/StarCraftII",
    "fake_key_comment": "sk-test-fake-key-do-not-use-0001"
  }
}
