{
  "schema_version": "2.0",
  "run_id": "20260916T165000Z_AbyssalReefLE_deadbeef",
  "seq": 0,
  "game_loop": 0,
  "source": "logger",
  "event_type": "run_manifest",
  "map_name": "AbyssalReefLE",
  "controller_tier": "T2",
  "chaos": false,
  "realtime": false,
  "mode": "defense_only",
  "started_at_utc": "2026-09-16T16:50:00Z",
  "opponent": "built_in_ai_hard",
  "seed": 42,
  "analysis_intent": "confirmatory",
  "llm_provider": "mock-provider",
  "git_sha": null,
  "git_dirty": null,
  "config_fingerprint": null,
  "prompt_hash": null,
  "sc2_version": null,
  "python_packages": null,
  "notes": {
    "synthetic": true
  }
}
